{
  "generator": {
    "frontend": "ts",
    "name": "kalup",
    "version": "0.1.0"
  },
  "irVersion": 1,
  "project": "acme-crm",
  "resources": {
    "group:companies/billing": {
      "definition": {
        "label": "Billing"
      },
      "managed": true,
      "type": "group"
    },
    "group:subscription/subscription_information": {
      "definition": {
        "label": "Subscription information"
      },
      "managed": true,
      "type": "group"
    },
    "object:subscription": {
      "binding": {
        "export": "Subscription"
      },
      "definition": {
        "labels": {
          "plural": "Subscriptions",
          "singular": "Subscription"
        },
        "primaryDisplayProperty": "name",
        "requiredProperties": ["name"]
      },
      "managed": true,
      "type": "object"
    },
    "property:companies/billing_id": {
      "binding": {
        "codec": "stringArray",
        "key": "billingId"
      },
      "definition": {
        "fieldType": "text",
        "group": {
          "$ref": "group:companies/billing"
        },
        "label": "Billing ID",
        "type": "string"
      },
      "lifecycle": {
        "options": "additive"
      },
      "managed": true,
      "type": "property"
    },
    "property:companies/billing_meta": {
      "binding": {
        "codec": "json",
        "key": "billingMeta"
      },
      "definition": {
        "fieldType": "textarea",
        "group": {
          "$ref": "group:companies/billing"
        },
        "label": "Billing meta",
        "type": "string"
      },
      "lifecycle": {
        "options": "additive"
      },
      "managed": true,
      "type": "property"
    },
    "property:companies/billing_status": {
      "binding": {
        "aliases": {
          "PAST DUE": "past_due"
        },
        "codec": "enum",
        "key": "billingStatus",
        "required": true
      },
      "definition": {
        "fieldType": "select",
        "group": {
          "$ref": "group:companies/billing"
        },
        "label": "Billing status",
        "options": [
          {
            "label": "Active",
            "value": "active"
          },
          {
            "label": "Past due",
            "value": "PAST DUE"
          }
        ],
        "type": "enumeration"
      },
      "lifecycle": {
        "ignoreChanges": ["description"],
        "options": "additive"
      },
      "managed": true,
      "type": "property"
    },
    "property:companies/lifetime_value": {
      "binding": {
        "codec": "number",
        "key": "lifetimeValue",
        "readonly": true
      },
      "managed": false,
      "type": "property"
    },
    "property:companies/name": {
      "binding": {
        "codec": "string",
        "key": "name"
      },
      "managed": false,
      "type": "property"
    },
    "property:subscription/customer_status": {
      "binding": {
        "codec": "enum",
        "key": "customerStatus"
      },
      "definition": {
        "fieldType": "select",
        "group": {
          "$ref": "group:subscription/subscription_information"
        },
        "label": "Customer status",
        "options": [
          {
            "label": "Trial",
            "value": "trial"
          },
          {
            "label": "Paying",
            "value": "paying"
          }
        ],
        "type": "enumeration"
      },
      "lifecycle": {
        "options": "additive"
      },
      "managed": true,
      "type": "property"
    },
    "property:subscription/name": {
      "binding": {
        "codec": "string",
        "key": "name"
      },
      "definition": {
        "fieldType": "text",
        "group": {
          "$ref": "group:subscription/subscription_information"
        },
        "label": "Name",
        "type": "string"
      },
      "lifecycle": {
        "options": "additive"
      },
      "managed": true,
      "type": "property"
    }
  },
  "targets": {
    "production": {
      "drift": "hold",
      "overrides": {
        "property:subscription/customer_status": {
          "name": "customerstatus"
        }
      },
      "portalId": 2222222,
      "protected": true
    },
    "sandbox": {
      "portalId": 1111111
    }
  },
  "tombstones": {}
}
