{
  "generator": {
    "frontend": "portal",
    "name": "kalup",
    "version": "0.2.0"
  },
  "irVersion": 1,
  "project": "fleet-ops",
  "resources": {
    "group:companies/logistics": {
      "definition": {
        "label": "Logistics"
      },
      "managed": true,
      "type": "group"
    }
  },
  "targets": {},
  "tombstones": {}
}
